name,activities,overview,links,phone,email,location
Hospital for Special Care,"Swimming, Table Tennis, Track and Field, Wheelchair Basketball, Wheelchair Tennis","The Hospital for Special Care is ready to help you on your fitness journey whether you are learning a sport for the first time, excited for competition or looking to advance personal goals. Our facilities and approach are accessible and appreciative of all ages, abilities and special needs. We are committed to creating an environment of health and wellness for staff, our patients and our community. Through our sports and fitness programs we give both children and adults the opportunity to achieve their goals and lead independent lives.",https://hfsc.org/sports-and-fitness/,860-832-6220,jconnolly@hfsc.org,"2150 Corbin Avenue, New Britain, CT 06053"
Leaf of Faith Adaptive Skiers,"Alpine Skiing, Snowboarding, Tubing,Wakeboarding, Water Skiing","Leaps of Faith Adaptive Skiers missionis to build lasting confidence and fulfillment through exposure and professionaltraining in recreational and competitive water and snow skiing to bothchildren, adults, and veterans with disabilities.",http://lofadaptiveskiers.org,203-426-0666,lofskiers@gmail.com,"PO Box 3505, Newtown, CT 06470"
"The Sports Association, Gaylord Hospital","Alpine Skiing, Archery, Boccia, Climbing,Curling, Cycling, Fishing, Golf, Kayaking, Rugby, Sled Hockey, Tennis,Triathlon, Water Skiing, Yoga",The Sports Association of GaylordHospital provides adaptive sports and recreation programs to adults withphysical disabilities and visual impairments in the state of Connecticut andthroughout the Northeast.,www.gaylord.org/sports,203-284-2772,sports@gaylord.org,"PO Box 400, 50 Gaylord Farm Rd,Wallingford, CT 06492"
Oak Hill Adaptive Sports and Fitness,"Basketball/ Wheelchair Basketball, Boccia,Lacrosse/ Wheelchair Lacrosse, Pickleball, Powerlifting, Strength Training, TableTennis, Yoga","Oak Hills provides health and wellnessto those with disabilities through fitness and sports programming. Oak Hillsensures that the quality, diversity, and availability of their programs areequal to everyone.",sportsandfitness.oakhillct.org/,860-286-3107,,"33 Coventry St. Hartford, CT 06112"
