name,activities,overview,links,phone,email,location
Tennessee Association of Bling Athletes,"Cycling, Goalball, Golf","TNABA, Tennessee Association of BlindAthletes, is a non-profit organization that provides sports and recreationalactivities for blind or visually impaired men, women, and children ofTennessee.",https://www.teamusa.org/About-the-USOPC/Paralympic-Programs/Find-A-Club/Club-Search/Tennessee-Association-of-Blind-Athletes,615-390-4178,Ricky.jones@tnaba.org,"P.O. Box 160185, Nashville, TN 37216"
"Sports, Arts & Recreation of Chattanooga (SPARC)","Alpine Skiing, Cycling, Kayaking, PaddleBoarding, Pontoon Boat, Running, Snowboarding, Triathlon, Tubing, Water Skiing,Wheelchair Basketball, Wheelchair Racing, Wheelchair Tennis","SPARC was formed by a group ofindividuals who believed that persons, regardless of ability, should have theopportunity to participate in competitive and recreational activities in anintegrated setting.",http://www.sparctn.org/,,SPARC@SPARCTN.ORG,"6638 Declaration Drive, Hixson, TN 37343"
